{"format":"rtt-replay","dtype":"float32","byte_order":"little","layout":["frames","bodies","pose"],"pose_fields":["px","py","pz","qx","qy","qz","qw"],"up_axis":"z","units":"m","version":2,"fps":30,"n_frames":168,"n_bodies":5,"bin":"finalist-e2e1361e6429.bin","assets":{},"bodies":[{"name":"palm","visuals":[],"geoms":[{"name":"wrist_flange","type":"cylinder","radius":0.0315,"half_height":0.012,"pos":[0.0,0.0,0.0],"quat_xyzw":[0.0,0.0,0.0,1.0],"rgba":[0.2,0.22,0.27,1.0]}]},{"name":"eff_cup_base","visuals":[],"geoms":[{"name":"eff_cup_base","type":"cylinder","radius":0.00705,"half_height":0.005,"pos":[0.0,0.0,-0.005],"quat_xyzw":[0.0,0.0,0.0,1.0],"rgba":[0.62,0.64,0.68,1.0]}]},{"name":"eff_cup_bellows","visuals":[],"geoms":[{"name":"eff_cup_bellows","type":"cylinder","radius":0.00752,"half_height":0.006,"pos":[0.0,0.0,-0.006],"quat_xyzw":[0.0,0.0,0.0,1.0],"rgba":[0.22,0.23,0.26,1.0]}]},{"name":"eff_cup","visuals":[],"geoms":[{"name":"eff_cup_face","type":"cylinder","radius":0.01034,"half_height":0.001,"pos":[0.0,0.0,-0.00039],"quat_xyzw":[0.0,0.0,0.0,1.0],"rgba":[0.22,0.23,0.26,1.0]},{"name":"eff_lip_00","type":"capsule","radius":0.00141,"half_length":0.0019,"pos":[0.01175,0.0,-0.003],"quat_xyzw":[-0.5,0.5,0.5,0.5],"rgba":[0.12,0.13,0.15,1.0]},{"name":"eff_lip_01","type":"capsule","radius":0.00141,"half_length":0.0019,"pos":[0.009885,0.006353,-0.003],"quat_xyzw":[-0.620613,0.33888,0.620613,0.33888],"rgba":[0.12,0.13,0.15,1.0]},{"name":"eff_lip_02","type":"capsule","radius":0.00141,"half_length":0.0019,"pos":[0.004881,0.010688,-0.003],"quat_xyzw":[-0.690947,0.150306,0.690947,0.150306],"rgba":[0.12,0.13,0.15,1.0]},{"name":"eff_lip_03","type":"capsule","radius":0.00141,"half_length":0.0019,"pos":[-0.001672,0.01163,-0.003],"quat_xyzw":[-0.705305,-0.050444,0.705305,-0.050444],"rgba":[0.12,0.13,0.15,1.0]},{"name":"eff_lip_04","type":"capsule","radius":0.00141,"half_length":0.0019,"pos":[-0.007695,0.00888,-0.003],"quat_xyzw":[-0.662524,-0.247108,0.662524,-0.247108],"rgba":[0.12,0.13,0.15,1.0]},{"name":"eff_lip_05","type":"capsule","radius":0.00141,"half_length":0.0019,"pos":[-0.011274,0.00331,-0.003],"quat_xyzw":[-0.566068,-0.423753,0.566068,-0.423753],"rgba":[0.12,0.13,0.15,1.0]},{"name":"eff_lip_06","type":"capsule","radius":0.00141,"half_length":0.0019,"pos":[-0.011274,-0.00331,-0.003],"quat_xyzw":[-0.423753,-0.566068,0.423753,-0.566068],"rgba":[0.12,0.13,0.15,1.0]},{"name":"eff_lip_07","type":"capsule","radius":0.00141,"half_length":0.0019,"pos":[-0.007695,-0.00888,-0.003],"quat_xyzw":[-0.247108,-0.662524,0.247108,-0.662524],"rgba":[0.12,0.13,0.15,1.0]},{"name":"eff_lip_08","type":"capsule","radius":0.00141,"half_length":0.0019,"pos":[-0.001672,-0.01163,-0.003],"quat_xyzw":[-0.050444,-0.705305,0.050444,-0.705305],"rgba":[0.12,0.13,0.15,1.0]},{"name":"eff_lip_09","type":"capsule","radius":0.00141,"half_length":0.0019,"pos":[0.004881,-0.010688,-0.003],"quat_xyzw":[0.150306,-0.690947,-0.150306,-0.690947],"rgba":[0.12,0.13,0.15,1.0]},{"name":"eff_lip_10","type":"capsule","radius":0.00141,"half_length":0.0019,"pos":[0.009885,-0.006353,-0.003],"quat_xyzw":[0.33888,-0.620613,-0.33888,-0.620613],"rgba":[0.12,0.13,0.15,1.0]}]},{"name":"object","visuals":[],"geoms":[{"name":"object","type":"mesh","vertices":[-0.015,-0.02,-0.03,0.015,-0.02,-0.03,0.015,0.02,-0.03,-0.015,0.02,-0.03,-0.015,-0.02,0.03,0.015,-0.02,0.03,0.015,0.02,0.03,-0.015,0.02,0.03],"faces":[3,2,1,3,1,0,4,5,6,4,6,7,0,1,5,0,5,4,1,2,6,1,6,5,2,3,7,2,7,6,3,0,4,3,4,7],"pos":[0.0,0.0,0.0],"quat_xyzw":[0.0,0.0,0.0,1.0],"rgba":[0.18,0.47,0.86,1.0]}]}],"meta":{"success":false,"held":false,"lift_success":false,"failure_mode":"missed_grasp","registered":false,"registration_flags":["off_centre","no_seal"],"seed":1923639404377323317,"design_space":"effector-suction","design_id":"e2e1361e642953448227908b4f18dee85c0fdbf722c08790001f029db51a543d","geometry_hash":"","part_id":"block","object":{"kind":"part","part_id":"block","family":"block","size":[0.03,0.04,0.06]},"placement":{"x":0.0,"y":0.0,"yaw":0.0,"err_x":-0.003,"err_y":0.0,"err_yaw":0.0},"perturbation":null,"task":"task_v2","task_digest":"8168db801332","flags":[],"effector":{"family":"suction","model":"designed-cup","display_name":"Designed suction cup, 24 mm","primitive":"seal","origin":"random","fidelity":"approximation","group":"random","label":"Product mode: not part of the pre-registered experiment"},"geometry_id":null,"label":"Product mode: not part of the pre-registered experiment","role":"finalist","condition_id":"train_v2/block/c2","reference":"nominal_episode"},"provenance":{"source":"simulation","engine":"mujoco","engine_version":"3.15.0","run_id":"effectors-block","code_version":"8c1011c4743f","product_mode":true,"episode":"finalist-e2e1361e6429","suite":"train_v2","condition":"train_v2/block/c2","seed":1923639404377323317,"created_utc":"2026-10-17T10:59:46Z"},"static":[{"name":"table","type":"box","half_size":[0.4,0.4,0.375],"pos":[0.0,0.0,-0.375],"quat_xyzw":[0.0,0.0,0.0,1.0],"rgba":[0.8,0.7,0.56,1.0]},{"name":"floor","type":"plane","half_size":[3.0,3.0],"pos":[0.0,0.0,-0.75],"quat_xyzw":[0.0,0.0,0.0,1.0],"rgba":[0.5,0.5,0.5,1.0]}],"overlays":{"bin":"finalist-e2e1361e6429.ovl.bin","dtype":"float16","byte_order":"little","layout":["frames","channels"],"channels":["offset_mm","seat_short_mm","hold_s","n_contacts"]}}
