{"format":"rtt-replay","dtype":"float32","byte_order":"little","layout":["frames","bodies","pose"],"pose_fields":["px","py","pz","qx","qy","qz","qw"],"up_axis":"z","units":"m","version":2,"fps":30,"n_frames":168,"n_bodies":5,"bin":"best-suction-3907bc284d9e.bin","assets":{},"bodies":[{"name":"palm","visuals":[],"geoms":[{"name":"wrist_flange","type":"cylinder","radius":0.0315,"half_height":0.012,"pos":[0.0,0.0,0.0],"quat_xyzw":[0.0,0.0,0.0,1.0],"rgba":[0.2,0.22,0.27,1.0]}]},{"name":"eff_cup_base","visuals":[],"geoms":[{"name":"eff_cup_base","type":"cylinder","radius":0.006,"half_height":0.005,"pos":[0.0,0.0,-0.005],"quat_xyzw":[0.0,0.0,0.0,1.0],"rgba":[0.62,0.64,0.68,1.0]}]},{"name":"eff_cup_bellows","visuals":[],"geoms":[{"name":"eff_cup_bellows","type":"cylinder","radius":0.00512,"half_height":0.006,"pos":[0.0,0.0,-0.006],"quat_xyzw":[0.0,0.0,0.0,1.0],"rgba":[0.22,0.23,0.26,1.0]}]},{"name":"eff_cup","visuals":[],"geoms":[{"name":"eff_cup_face","type":"cylinder","radius":0.00704,"half_height":0.001,"pos":[0.0,0.0,-0.00084],"quat_xyzw":[0.0,0.0,0.0,1.0],"rgba":[0.22,0.23,0.26,1.0]},{"name":"eff_lip_00","type":"capsule","radius":0.00096,"half_length":0.001111,"pos":[0.008,0.0,-0.003],"quat_xyzw":[-0.5,0.5,0.5,0.5],"rgba":[0.12,0.13,0.15,1.0]},{"name":"eff_lip_01","type":"capsule","radius":0.00096,"half_length":0.001111,"pos":[0.006928,0.004,-0.003],"quat_xyzw":[-0.612372,0.353553,0.612372,0.353553],"rgba":[0.12,0.13,0.15,1.0]},{"name":"eff_lip_02","type":"capsule","radius":0.00096,"half_length":0.001111,"pos":[0.004,0.006928,-0.003],"quat_xyzw":[-0.683013,0.183013,0.683013,0.183013],"rgba":[0.12,0.13,0.15,1.0]},{"name":"eff_lip_03","type":"capsule","radius":0.00096,"half_length":0.001111,"pos":[0.0,0.008,-0.003],"quat_xyzw":[-0.707107,0.0,0.707107,0.0],"rgba":[0.12,0.13,0.15,1.0]},{"name":"eff_lip_04","type":"capsule","radius":0.00096,"half_length":0.001111,"pos":[-0.004,0.006928,-0.003],"quat_xyzw":[-0.683013,-0.183013,0.683013,-0.183013],"rgba":[0.12,0.13,0.15,1.0]},{"name":"eff_lip_05","type":"capsule","radius":0.00096,"half_length":0.001111,"pos":[-0.006928,0.004,-0.003],"quat_xyzw":[-0.612372,-0.353553,0.612372,-0.353553],"rgba":[0.12,0.13,0.15,1.0]},{"name":"eff_lip_06","type":"capsule","radius":0.00096,"half_length":0.001111,"pos":[-0.008,0.0,-0.003],"quat_xyzw":[-0.5,-0.5,0.5,-0.5],"rgba":[0.12,0.13,0.15,1.0]},{"name":"eff_lip_07","type":"capsule","radius":0.00096,"half_length":0.001111,"pos":[-0.006928,-0.004,-0.003],"quat_xyzw":[-0.353553,-0.612372,0.353553,-0.612372],"rgba":[0.12,0.13,0.15,1.0]},{"name":"eff_lip_08","type":"capsule","radius":0.00096,"half_length":0.001111,"pos":[-0.004,-0.006928,-0.003],"quat_xyzw":[-0.183013,-0.683013,0.183013,-0.683013],"rgba":[0.12,0.13,0.15,1.0]},{"name":"eff_lip_09","type":"capsule","radius":0.00096,"half_length":0.001111,"pos":[-0.0,-0.008,-0.003],"quat_xyzw":[-0.0,-0.707107,0.0,-0.707107],"rgba":[0.12,0.13,0.15,1.0]},{"name":"eff_lip_10","type":"capsule","radius":0.00096,"half_length":0.001111,"pos":[0.004,-0.006928,-0.003],"quat_xyzw":[0.183013,-0.683013,-0.183013,-0.683013],"rgba":[0.12,0.13,0.15,1.0]},{"name":"eff_lip_11","type":"capsule","radius":0.00096,"half_length":0.001111,"pos":[0.006928,-0.004,-0.003],"quat_xyzw":[0.353553,-0.612372,-0.353553,-0.612372],"rgba":[0.12,0.13,0.15,1.0]}]},{"name":"object","visuals":[],"geoms":[{"name":"object","type":"mesh","vertices":[-0.002,0.015,-0.018,-0.002,0.015,0.018,-0.002,-0.015,0.018,-0.002,-0.015,-0.018,0.002,0.015,-0.018,0.002,0.015,0.018,0.002,-0.015,0.018,0.002,-0.015,-0.018],"faces":[3,2,1,3,1,0,4,5,6,4,6,7,0,1,5,0,5,4,1,2,6,1,6,5,2,3,7,2,7,6,3,0,4,3,4,7],"pos":[-0.02,0.0,-0.018],"quat_xyzw":[0.707107,0.0,0.707107,0.0],"rgba":[0.18,0.47,0.86,1.0]},{"name":"object_01","type":"mesh","vertices":[-0.002,-0.015,-0.02,0.002,-0.015,-0.02,0.002,0.015,-0.02,-0.002,0.015,-0.02,-0.002,-0.015,0.02,0.002,-0.015,0.02,0.002,0.015,0.02,-0.002,0.015,0.02],"faces":[3,2,1,3,1,0,4,5,6,4,6,7,0,1,5,0,5,4,1,2,6,1,6,5,2,3,7,2,7,6,3,0,4,3,4,7],"pos":[0.0,0.0,0.0],"quat_xyzw":[0.0,0.0,0.0,1.0],"rgba":[0.18,0.47,0.86,1.0]}]}],"meta":{"success":false,"held":false,"lift_success":false,"failure_mode":"missed_grasp","registered":false,"registration_flags":["off_centre","no_seal"],"seed":7936365254780240449,"design_space":"effector-suction","design_id":"3907bc284d9e2c3399ddb8b45b1bf94dbb3b0ef0672705c6d90724839ecf7186","geometry_hash":"","part_id":"l_bracket","object":{"kind":"part","part_id":"l_bracket","family":"l_bracket","size":[0.04,0.03,0.04]},"placement":{"x":0.0,"y":0.0,"yaw":0.0,"err_x":-0.003,"err_y":0.0,"err_yaw":0.0},"perturbation":null,"task":"task_v2","task_digest":"8168db801332","flags":[],"effector":{"family":"suction","model":"cup-16mm","display_name":"Suction cup, 16 mm bellows","primitive":"seal","origin":"preset","fidelity":"approximation","group":"suction","label":"Product mode: not part of the pre-registered experiment"},"geometry_id":null,"label":"Product mode: not part of the pre-registered experiment","role":"best_suction","condition_id":"train_v2/l_bracket/c2","reference":"analytic"},"provenance":{"source":"simulation","engine":"mujoco","engine_version":"3.15.0","run_id":"effectors-l-bracket","code_version":"8c1011c4743f","product_mode":true,"episode":"best-suction-3907bc284d9e","suite":"train_v2","condition":"train_v2/l_bracket/c2","seed":7936365254780240449,"created_utc":"2026-10-17T11:04:12Z"},"static":[{"name":"table","type":"box","half_size":[0.4,0.4,0.375],"pos":[0.0,0.0,-0.375],"quat_xyzw":[0.0,0.0,0.0,1.0],"rgba":[0.8,0.7,0.56,1.0]},{"name":"floor","type":"plane","half_size":[3.0,3.0],"pos":[0.0,0.0,-0.75],"quat_xyzw":[0.0,0.0,0.0,1.0],"rgba":[0.5,0.5,0.5,1.0]}],"overlays":{"bin":"best-suction-3907bc284d9e.ovl.bin","dtype":"float16","byte_order":"little","layout":["frames","channels"],"channels":["offset_mm","seat_short_mm","hold_s","n_contacts"]}}
