{"format":"rtt-replay","dtype":"float32","byte_order":"little","layout":["frames","bodies","pose"],"pose_fields":["px","py","pz","qx","qy","qz","qw"],"up_axis":"z","units":"m","version":2,"fps":30,"n_frames":181,"n_bodies":7,"bin":"best-catalog-52613f2b7214.bin","assets":{},"bodies":[{"name":"palm","visuals":[],"geoms":[{"name":"wrist_flange","type":"cylinder","radius":0.0315,"half_height":0.012,"pos":[0.0,0.0,0.0],"quat_xyzw":[0.0,0.0,0.0,1.0],"rgba":[0.2,0.22,0.27,1.0]}]},{"name":"eff_base","visuals":[],"geoms":[{"name":"eff_base","type":"box","half_size":[0.013,0.038,0.008],"pos":[0.0,0.0,-0.008],"quat_xyzw":[0.0,0.0,0.0,1.0],"rgba":[0.35,0.37,0.4,1.0]}]},{"name":"eff_f0_proximal","visuals":[],"geoms":[{"name":"eff_f0_proximal","type":"box","half_size":[0.009,0.004,0.025],"pos":[0.0,0.0,-0.025],"quat_xyzw":[0.0,0.0,0.0,1.0],"rgba":[0.2,0.45,0.75,1.0]}]},{"name":"eff_f0_distal","visuals":[],"geoms":[{"name":"eff_f0_distal","type":"box","half_size":[0.009,0.004,0.0175],"pos":[0.0,0.0,-0.0175],"quat_xyzw":[0.0,0.0,0.0,1.0],"rgba":[0.25,0.55,0.85,1.0]}]},{"name":"eff_f1_proximal","visuals":[],"geoms":[{"name":"eff_f1_proximal","type":"box","half_size":[0.009,0.004,0.025],"pos":[0.0,0.0,-0.025],"quat_xyzw":[0.0,0.0,0.0,1.0],"rgba":[0.2,0.45,0.75,1.0]}]},{"name":"eff_f1_distal","visuals":[],"geoms":[{"name":"eff_f1_distal","type":"box","half_size":[0.009,0.004,0.0175],"pos":[0.0,0.0,-0.0175],"quat_xyzw":[0.0,0.0,0.0,1.0],"rgba":[0.25,0.55,0.85,1.0]}]},{"name":"object","visuals":[],"geoms":[{"name":"object","type":"mesh","vertices":[-0.002,0.015,-0.018,-0.002,0.015,0.018,-0.002,-0.015,0.018,-0.002,-0.015,-0.018,0.002,0.015,-0.018,0.002,0.015,0.018,0.002,-0.015,0.018,0.002,-0.015,-0.018],"faces":[3,2,1,3,1,0,4,5,6,4,6,7,0,1,5,0,5,4,1,2,6,1,6,5,2,3,7,2,7,6,3,0,4,3,4,7],"pos":[-0.02,0.0,-0.018],"quat_xyzw":[0.707107,0.0,0.707107,0.0],"rgba":[0.18,0.47,0.86,1.0]},{"name":"object_01","type":"mesh","vertices":[-0.002,-0.015,-0.02,0.002,-0.015,-0.02,0.002,0.015,-0.02,-0.002,0.015,-0.02,-0.002,-0.015,0.02,0.002,-0.015,0.02,0.002,0.015,0.02,-0.002,0.015,0.02],"faces":[3,2,1,3,1,0,4,5,6,4,6,7,0,1,5,0,5,4,1,2,6,1,6,5,2,3,7,2,7,6,3,0,4,3,4,7],"pos":[0.0,0.0,0.0],"quat_xyzw":[0.0,0.0,0.0,1.0],"rgba":[0.18,0.47,0.86,1.0]}]}],"meta":{"success":false,"held":true,"lift_success":true,"failure_mode":"not_registered","registered":false,"registration_flags":["off_centre"],"seed":7936365254780240449,"design_space":"effector-catalog_gripper","design_id":"52613f2b72143b61b490ddfc05c4e3ed38c49de7005b77f07a5ccbfada0ab476","geometry_hash":"","part_id":"l_bracket","object":{"kind":"part","part_id":"l_bracket","family":"l_bracket","size":[0.04,0.03,0.04]},"placement":{"x":0.0,"y":0.0,"yaw":0.0,"err_x":-0.003,"err_y":0.0,"err_yaw":0.0},"perturbation":null,"task":"task_v2","task_digest":"8168db801332","flags":[],"effector":{"family":"catalog_gripper","model":"adaptive-2f","display_name":"Two-finger adaptive gripper, pinch","primitive":"pinch","origin":"catalog","fidelity":"rigid","group":"catalog","label":"Product mode: not part of the pre-registered experiment"},"geometry_id":null,"label":"Product mode: not part of the pre-registered experiment","role":"best_catalog","condition_id":"train_v2/l_bracket/c2","reference":"nominal_episode"},"provenance":{"source":"simulation","engine":"mujoco","engine_version":"3.15.0","run_id":"effectors-l-bracket","code_version":"790c47d65853","product_mode":true,"episode":"best-catalog-52613f2b7214","suite":"train_v2","condition":"train_v2/l_bracket/c2","seed":7936365254780240449,"created_utc":"2026-10-17T11:54:22Z"},"static":[{"name":"table","type":"box","half_size":[0.4,0.4,0.375],"pos":[0.0,0.0,-0.375],"quat_xyzw":[0.0,0.0,0.0,1.0],"rgba":[0.8,0.7,0.56,1.0]},{"name":"floor","type":"plane","half_size":[3.0,3.0],"pos":[0.0,0.0,-0.75],"quat_xyzw":[0.0,0.0,0.0,1.0],"rgba":[0.5,0.5,0.5,1.0]}],"overlays":{"bin":"best-catalog-52613f2b7214.ovl.bin","dtype":"float16","byte_order":"little","layout":["frames","channels"],"channels":["offset_mm","seat_short_mm","hold_s","n_contacts"]}}
