{"format":"rtt-replay","version":2,"fps":30,"dtype":"float32","byte_order":"little","layout":["frames","bodies","pose"],"pose_fields":["px","py","pz","qx","qy","qz","qw"],"up_axis":"z","units":"m","n_frames":489,"n_bodies":4,"bin":"best_single.bin","assets":{"0123e5167ce25cba":{"uri":"assets/0123e5167ce25cba.glb","sha256":"0123e5167ce25cba97d908090a876f183bf7f6f86864bd59cade30012c3fdda0","bytes":2052,"role":"object","license":"Apache-2.0","attribution":"Robot Tool Tournament (Apache-2.0)","changes":[],"label":"Studio task object: obj_pack_body","media_type":"model/gltf-binary","source":{"kind":"generated","generator":"rtt.render.glb"}},"1ea6a12bad64f6d5":{"uri":"assets/1ea6a12bad64f6d5.glb","sha256":"1ea6a12bad64f6d519a256682ef555e1978c83aec5fc149f3da226e021621b71","bytes":2312,"role":"gripper_frame","license":"BSD-3-Clause","attribution":"Simulation model of an open-source industrial gripper, BSD-3-Clause, modified (full credit: /credits#library)","changes":["the simulation model's collision geometry only, as the simulator used it","re-posed into the replay body frame","re-encoded as GLB"],"label":"Studio tool body: eff_left_finger","media_type":"model/gltf-binary","source":{"kind":"generated","generator":"rtt.render.glb"}},"36914fd652a388ac":{"uri":"assets/36914fd652a388ac.glb","sha256":"36914fd652a388ac9cc9a063f0ddde12f2a6befc4829c85866bfafd262c6af34","bytes":2088,"role":"object","license":"Apache-2.0","attribution":"Robot Tool Tournament (Apache-2.0)","changes":[],"label":"Studio task object: obj_tote_lid_panel","media_type":"model/gltf-binary","source":{"kind":"generated","generator":"rtt.render.glb"}},"448271b973a7bfa2":{"uri":"assets/448271b973a7bfa2.glb","sha256":"448271b973a7bfa20ef875289f5c559fbd9ad7fd5da95381813891b7dcc53a3b","bytes":2056,"role":"object","license":"Apache-2.0","attribution":"Robot Tool Tournament (Apache-2.0)","changes":[],"label":"Studio task object: obj_carton_body","media_type":"model/gltf-binary","source":{"kind":"generated","generator":"rtt.render.glb"}},"691688bf56f92703":{"uri":"assets/691688bf56f92703.glb","sha256":"691688bf56f927036edab42ba0a3ddd6c88ab150212c99b0d7884fd511f92b27","bytes":2088,"role":"object","license":"Apache-2.0","attribution":"Robot Tool Tournament (Apache-2.0)","changes":[],"label":"Studio task object: obj_tote_lid_frame","media_type":"model/gltf-binary","source":{"kind":"generated","generator":"rtt.render.glb"}},"aad9db51e1bc19ca":{"uri":"assets/aad9db51e1bc19ca.glb","sha256":"aad9db51e1bc19cad49ddcaff2d6fe9ccfd07a36e666c322d4810d01de1d87fd","bytes":2640,"role":"gripper_frame","license":"Apache-2.0","attribution":"Robot Tool Tournament (Apache-2.0)","changes":[],"label":"Studio wrist flange: wrist_flange","media_type":"model/gltf-binary","source":{"kind":"generated","generator":"rtt.render.glb"}},"c436a7e1f96f43dd":{"uri":"assets/c436a7e1f96f43dd.glb","sha256":"c436a7e1f96f43dd2831c2596a2ecfc448082cfe4685217c876864d9ec3a5738","bytes":2504,"role":"object","license":"Apache-2.0","attribution":"Robot Tool Tournament (Apache-2.0)","changes":[],"label":"Studio task object: obj_tote_bin_frame","media_type":"model/gltf-binary","source":{"kind":"generated","generator":"rtt.render.glb"}},"ee1adb6b38ef8bf8":{"uri":"assets/ee1adb6b38ef8bf8.glb","sha256":"ee1adb6b38ef8bf8295327d04f790a6862f13f36f2a9fc2988474bcf8ea31d0c","bytes":2320,"role":"gripper_frame","license":"BSD-3-Clause","attribution":"Simulation model of an open-source industrial gripper, BSD-3-Clause, modified (full credit: /credits#library)","changes":["the simulation model's collision geometry only, as the simulator used it","re-posed into the replay body frame","re-encoded as GLB"],"label":"Studio tool body: eff_body","media_type":"model/gltf-binary","source":{"kind":"generated","generator":"rtt.render.glb"}}},"bodies":[{"name":"palm_wrist_flange","visuals":[{"asset":"aad9db51e1bc19ca","pos":[0.0,0.0,0.0],"quat_xyzw":[0.0,0.0,0.0,1.0],"scale":[1.0,1.0,1.0]}]},{"name":"finger_t0_eff_body","visuals":[{"asset":"ee1adb6b38ef8bf8","pos":[0.0,0.0,0.0],"quat_xyzw":[0.0,0.0,0.0,1.0],"scale":[1.0,1.0,1.0]}]},{"name":"finger_t0_eff_left_finger","visuals":[{"asset":"1ea6a12bad64f6d5","pos":[0.0,0.0,0.0],"quat_xyzw":[0.0,0.0,0.0,1.0],"scale":[1.0,1.0,1.0]}]},{"name":"finger_t0_eff_right_finger","visuals":[{"asset":"1ea6a12bad64f6d5","pos":[0.0,0.0,0.0],"quat_xyzw":[0.0,0.0,0.0,1.0],"scale":[1.0,1.0,1.0]}]}],"static":[{"name":"table","type":"box","half_size":[0.4,0.4,0.375],"pos":[0.0,0.0,-0.375],"quat_xyzw":[0.0,0.0,0.0,1.0],"rgba":[0.8,0.7,0.56,1.0]}],"meta":{"design_space":"studio-single","design_id":"d136ab4824c1bad26b5ac84b7a481c14bedee5790c495f0eb8c1c9369bb11a57","geometry_id":null,"part_id":"h1","label":"Product mode: not part of the pre-registered experiment","lane":"best_single","setup_label":"Industrial servo parallel gripper, 110 mm stroke","task_id":"e4586f3612e11b0eb490349c52a109bec75f43fdb0bcf9f1d91127f9e01a4ad5","traj_sha":"fcef030e32a2508c6cb211991d75649b3a3eb872a07f9565c84fdd50074a9f8c","condition_id":"nominal","seed":0,"completed":false,"cycle_time_s":16.284,"segments":[{"index":0,"tool":0,"tool_label":"Industrial servo parallel gripper, 110 mm stroke","start_s":0.0,"end_s":16.284,"change":"none","change_s":0.0,"change_start_s":0.0,"steps":["open_lid"]}],"steps":[{"step_id":"open_lid","primitive":"hook_pull","tool":0,"start_s":0.0,"duration_s":16.284,"success":false,"failure_mode":"slip","fidelity":"rigid","quantities":{"angle_deg":0.0,"force_n":10.92,"penetration_mm":0.045,"slip_mm":389.154}}],"tool_stand":"display only: a tool that is not on the wrist rests here; nothing about it is simulated"},"provenance":{"source":"simulation","engine":"mujoco","engine_version":"3.15.0","run_id":"studio-h1-d136ab4824c1","code_version":"67c08249edc8","product_mode":true,"episode":"studio full-task run","suite":"studio-heroes","condition":"nominal","seed":0,"task_sha256":"e4586f3612e11b0eb490349c52a109bec75f43fdb0bcf9f1d91127f9e01a4ad5","record_version":1},"static_visuals":[{"asset":"448271b973a7bfa2","pos":[-0.2,-0.2,0.03],"quat_xyzw":[0.0,0.0,0.0,1.0],"scale":[1.0,1.0,1.0]},{"asset":"0123e5167ce25cba","pos":[0.2,-0.2,0.01],"quat_xyzw":[0.0,0.0,0.0,1.0],"scale":[1.0,1.0,1.0]},{"asset":"c436a7e1f96f43dd","pos":[0.0,0.0,0.0],"quat_xyzw":[0.0,0.0,0.0,1.0],"scale":[1.0,1.0,1.0]},{"asset":"691688bf56f92703","pos":[0.0,0.0,0.0],"quat_xyzw":[0.0,0.0,0.0,1.0],"scale":[1.0,1.0,1.0]},{"asset":"36914fd652a388ac","pos":[0.0,0.12,0.123],"quat_xyzw":[0.0,0.0,0.0,1.0],"scale":[1.0,1.0,1.0]}]}
