{"format":"rtt-replay","dtype":"float32","byte_order":"little","layout":["frames","bodies","pose"],"pose_fields":["px","py","pz","qx","qy","qz","qw"],"up_axis":"z","units":"m","version":2,"fps":30,"n_frames":80,"n_bodies":23,"bin":"best-soft-arm-2f5e4f974b13.bin","assets":{},"bodies":[{"name":"palm","visuals":[],"geoms":[{"name":"wrist_flange","type":"cylinder","radius":0.0315,"half_height":0.012,"pos":[0.0,0.0,0.0],"quat_xyzw":[0.0,0.0,0.0,1.0],"rgba":[0.2,0.22,0.27,1.0]}]},{"name":"eff_arm_base","visuals":[],"geoms":[{"name":"eff_arm_housing","type":"box","half_size":[0.012,0.0255,0.005],"pos":[0.0,0.0135,-0.005],"quat_xyzw":[0.0,0.0,0.0,1.0],"rgba":[0.62,0.64,0.68,1.0]},{"name":"eff_arm_post","type":"capsule","radius":0.007,"half_length":0.03,"pos":[0.0,0.032,-0.04],"quat_xyzw":[0.0,0.0,0.0,1.0],"rgba":[0.62,0.64,0.68,1.0]}]},{"name":"eff_seg_00","visuals":[],"geoms":[{"name":"eff_seg_00","type":"capsule","radius":0.006,"half_length":0.0045,"pos":[0.0045,0.0,0.0],"quat_xyzw":[0.0,-0.707107,0.0,0.707107],"rgba":[0.85,0.42,0.36,1.0]}]},{"name":"eff_seg_01","visuals":[],"geoms":[{"name":"eff_seg_01","type":"capsule","radius":0.005842,"half_length":0.0045,"pos":[0.0045,0.0,0.0],"quat_xyzw":[0.0,-0.707107,0.0,0.707107],"rgba":[0.85,0.42,0.36,1.0]}]},{"name":"eff_seg_02","visuals":[],"geoms":[{"name":"eff_seg_02","type":"capsule","radius":0.005684,"half_length":0.0045,"pos":[0.0045,0.0,0.0],"quat_xyzw":[0.0,-0.707107,0.0,0.707107],"rgba":[0.85,0.42,0.36,1.0]}]},{"name":"eff_seg_03","visuals":[],"geoms":[{"name":"eff_seg_03","type":"capsule","radius":0.005526,"half_length":0.0045,"pos":[0.0045,0.0,0.0],"quat_xyzw":[0.0,-0.707107,0.0,0.707107],"rgba":[0.85,0.42,0.36,1.0]}]},{"name":"eff_seg_04","visuals":[],"geoms":[{"name":"eff_seg_04","type":"capsule","radius":0.005368,"half_length":0.0045,"pos":[0.0045,0.0,0.0],"quat_xyzw":[0.0,-0.707107,0.0,0.707107],"rgba":[0.85,0.42,0.36,1.0]}]},{"name":"eff_seg_05","visuals":[],"geoms":[{"name":"eff_seg_05","type":"capsule","radius":0.005211,"half_length":0.0045,"pos":[0.0045,0.0,0.0],"quat_xyzw":[0.0,-0.707107,0.0,0.707107],"rgba":[0.85,0.42,0.36,1.0]}]},{"name":"eff_seg_06","visuals":[],"geoms":[{"name":"eff_seg_06","type":"capsule","radius":0.005053,"half_length":0.0045,"pos":[0.0045,0.0,0.0],"quat_xyzw":[0.0,-0.707107,0.0,0.707107],"rgba":[0.85,0.42,0.36,1.0]}]},{"name":"eff_seg_07","visuals":[],"geoms":[{"name":"eff_seg_07","type":"capsule","radius":0.004895,"half_length":0.0045,"pos":[0.0045,0.0,0.0],"quat_xyzw":[0.0,-0.707107,0.0,0.707107],"rgba":[0.85,0.42,0.36,1.0]}]},{"name":"eff_seg_08","visuals":[],"geoms":[{"name":"eff_seg_08","type":"capsule","radius":0.004737,"half_length":0.0045,"pos":[0.0045,0.0,0.0],"quat_xyzw":[0.0,-0.707107,0.0,0.707107],"rgba":[0.85,0.42,0.36,1.0]}]},{"name":"eff_seg_09","visuals":[],"geoms":[{"name":"eff_seg_09","type":"capsule","radius":0.004579,"half_length":0.0045,"pos":[0.0045,0.0,0.0],"quat_xyzw":[0.0,-0.707107,0.0,0.707107],"rgba":[0.85,0.42,0.36,1.0]}]},{"name":"eff_seg_10","visuals":[],"geoms":[{"name":"eff_seg_10","type":"capsule","radius":0.004421,"half_length":0.0045,"pos":[0.0045,0.0,0.0],"quat_xyzw":[0.0,-0.707107,0.0,0.707107],"rgba":[0.85,0.42,0.36,1.0]}]},{"name":"eff_seg_11","visuals":[],"geoms":[{"name":"eff_seg_11","type":"capsule","radius":0.004263,"half_length":0.0045,"pos":[0.0045,0.0,0.0],"quat_xyzw":[0.0,-0.707107,0.0,0.707107],"rgba":[0.85,0.42,0.36,1.0]}]},{"name":"eff_seg_12","visuals":[],"geoms":[{"name":"eff_seg_12","type":"capsule","radius":0.004105,"half_length":0.0045,"pos":[0.0045,0.0,0.0],"quat_xyzw":[0.0,-0.707107,0.0,0.707107],"rgba":[0.85,0.42,0.36,1.0]}]},{"name":"eff_seg_13","visuals":[],"geoms":[{"name":"eff_seg_13","type":"capsule","radius":0.003947,"half_length":0.0045,"pos":[0.0045,0.0,0.0],"quat_xyzw":[0.0,-0.707107,0.0,0.707107],"rgba":[0.85,0.42,0.36,1.0]}]},{"name":"eff_seg_14","visuals":[],"geoms":[{"name":"eff_seg_14","type":"capsule","radius":0.003789,"half_length":0.0045,"pos":[0.0045,0.0,0.0],"quat_xyzw":[0.0,-0.707107,0.0,0.707107],"rgba":[0.85,0.42,0.36,1.0]}]},{"name":"eff_seg_15","visuals":[],"geoms":[{"name":"eff_seg_15","type":"capsule","radius":0.003632,"half_length":0.0045,"pos":[0.0045,0.0,0.0],"quat_xyzw":[0.0,-0.707107,0.0,0.707107],"rgba":[0.85,0.42,0.36,1.0]}]},{"name":"eff_seg_16","visuals":[],"geoms":[{"name":"eff_seg_16","type":"capsule","radius":0.003474,"half_length":0.0045,"pos":[0.0045,0.0,0.0],"quat_xyzw":[0.0,-0.707107,0.0,0.707107],"rgba":[0.85,0.42,0.36,1.0]}]},{"name":"eff_seg_17","visuals":[],"geoms":[{"name":"eff_seg_17","type":"capsule","radius":0.003316,"half_length":0.0045,"pos":[0.0045,0.0,0.0],"quat_xyzw":[0.0,-0.707107,0.0,0.707107],"rgba":[0.85,0.42,0.36,1.0]}]},{"name":"eff_seg_18","visuals":[],"geoms":[{"name":"eff_seg_18","type":"capsule","radius":0.003158,"half_length":0.0045,"pos":[0.0045,0.0,0.0],"quat_xyzw":[0.0,-0.707107,0.0,0.707107],"rgba":[0.85,0.42,0.36,1.0]}]},{"name":"eff_seg_19","visuals":[],"geoms":[{"name":"eff_seg_19","type":"capsule","radius":0.003,"half_length":0.0045,"pos":[0.0045,0.0,0.0],"quat_xyzw":[0.0,-0.707107,0.0,0.707107],"rgba":[0.85,0.42,0.36,1.0]}]},{"name":"object","visuals":[],"geoms":[{"name":"object","type":"mesh","vertices":[-0.02,-0.00197,-0.025,-0.019231,-0.005834,-0.025,-0.017724,-0.009474,-0.025,-0.015535,-0.012749,-0.025,-0.012749,-0.015535,-0.025,-0.009474,-0.017724,-0.025,-0.005834,-0.019231,-0.025,-0.00197,-0.02,-0.025,0.00197,-0.02,-0.025,0.005834,-0.019231,-0.025,0.009474,-0.017724,-0.025,0.012749,-0.015535,-0.025,0.015535,-0.012749,-0.025,0.017724,-0.009474,-0.025,0.019231,-0.005834,-0.025,0.02,-0.00197,-0.025,0.02,0.00197,-0.025,0.019231,0.005834,-0.025,0.017724,0.009474,-0.025,0.015535,0.012749,-0.025,0.012749,0.015535,-0.025,0.009474,0.017724,-0.025,0.005834,0.019231,-0.025,0.00197,0.02,-0.025,-0.00197,0.02,-0.025,-0.005834,0.019231,-0.025,-0.009474,0.017724,-0.025,-0.012749,0.015535,-0.025,-0.015535,0.012749,-0.025,-0.017724,0.009474,-0.025,-0.019231,0.005834,-0.025,-0.02,0.00197,-0.025,-0.02,-0.00197,0.025,-0.019231,-0.005834,0.025,-0.017724,-0.009474,0.025,-0.015535,-0.012749,0.025,-0.012749,-0.015535,0.025,-0.009474,-0.017724,0.025,-0.005834,-0.019231,0.025,-0.00197,-0.02,0.025,0.00197,-0.02,0.025,0.005834,-0.019231,0.025,0.009474,-0.017724,0.025,0.012749,-0.015535,0.025,0.015535,-0.012749,0.025,0.017724,-0.009474,0.025,0.019231,-0.005834,0.025,0.02,-0.00197,0.025,0.02,0.00197,0.025,0.019231,0.005834,0.025,0.017724,0.009474,0.025,0.015535,0.012749,0.025,0.012749,0.015535,0.025,0.009474,0.017724,0.025,0.005834,0.019231,0.025,0.00197,0.02,0.025,-0.00197,0.02,0.025,-0.005834,0.019231,0.025,-0.009474,0.017724,0.025,-0.012749,0.015535,0.025,-0.015535,0.012749,0.025,-0.017724,0.009474,0.025,-0.019231,0.005834,0.025,-0.02,0.00197,0.025],"faces":[31,30,29,31,29,28,31,28,27,31,27,26,31,26,25,31,25,24,31,24,23,31,23,22,31,22,21,31,21,20,31,20,19,31,19,18,31,18,17,31,17,16,31,16,15,31,15,14,31,14,13,31,13,12,31,12,11,31,11,10,31,10,9,31,9,8,31,8,7,31,7,6,31,6,5,31,5,4,31,4,3,31,3,2,31,2,1,31,1,0,32,33,34,32,34,35,32,35,36,32,36,37,32,37,38,32,38,39,32,39,40,32,40,41,32,41,42,32,42,43,32,43,44,32,44,45,32,45,46,32,46,47,32,47,48,32,48,49,32,49,50,32,50,51,32,51,52,32,52,53,32,53,54,32,54,55,32,55,56,32,56,57,32,57,58,32,58,59,32,59,60,32,60,61,32,61,62,32,62,63,0,1,33,0,33,32,1,2,34,1,34,33,2,3,35,2,35,34,3,4,36,3,36,35,4,5,37,4,37,36,5,6,38,5,38,37,6,7,39,6,39,38,7,8,40,7,40,39,8,9,41,8,41,40,9,10,42,9,42,41,10,11,43,10,43,42,11,12,44,11,44,43,12,13,45,12,45,44,13,14,46,13,46,45,14,15,47,14,47,46,15,16,48,15,48,47,16,17,49,16,49,48,17,18,50,17,50,49,18,19,51,18,51,50,19,20,52,19,52,51,20,21,53,20,53,52,21,22,54,21,54,53,22,23,55,22,55,54,23,24,56,23,56,55,24,25,57,24,57,56,25,26,58,25,58,57,26,27,59,26,59,58,27,28,60,27,60,59,28,29,61,28,61,60,29,30,62,29,62,61,30,31,63,30,63,62,31,0,32,31,32,63],"pos":[-0.0,-0.0,0.0],"quat_xyzw":[0.0,0.0,0.0,1.0],"rgba":[0.18,0.47,0.86,1.0]}]}],"meta":{"success":false,"held":false,"lift_success":false,"failure_mode":"ejected_on_close","registered":false,"registration_flags":["not_measured"],"seed":1536070491857272883,"design_space":"effector-soft_arm","design_id":"2f5e4f974b13a6445127a6afead695a9e58a54cdeb12a3101724db21f6b368e9","geometry_hash":"","part_id":"steel_slug","object":{"kind":"part","part_id":"steel_slug","family":"slug","size":[0.04,0.04,0.05]},"placement":{"x":0.0,"y":0.0,"yaw":0.0,"err_x":-0.003,"err_y":0.0,"err_yaw":0.0},"perturbation":null,"task":"task_v2","task_digest":"8168db801332","flags":["penetration"],"effector":{"family":"soft_arm","model":"tentacle-20-soft","display_name":"Soft arm, 20 soft segments, 180 mm","primitive":"wrap","origin":"preset","fidelity":"approximation","group":"soft_arm","label":"Product mode: not part of the pre-registered experiment"},"geometry_id":null,"label":"Product mode: not part of the pre-registered experiment","role":"best_soft_arm","condition_id":"train_v2/steel_slug/c2","reference":"nominal_episode"},"provenance":{"source":"simulation","engine":"mujoco","engine_version":"3.15.0","run_id":"effectors-steel-slug","code_version":"790c47d65853","product_mode":true,"episode":"best-soft-arm-2f5e4f974b13","suite":"train_v2","condition":"train_v2/steel_slug/c2","seed":1536070491857272883,"created_utc":"2026-10-17T11:55:42Z"},"static":[{"name":"table","type":"box","half_size":[0.4,0.4,0.375],"pos":[0.0,0.0,-0.375],"quat_xyzw":[0.0,0.0,0.0,1.0],"rgba":[0.8,0.7,0.56,1.0]},{"name":"floor","type":"plane","half_size":[3.0,3.0],"pos":[0.0,0.0,-0.75],"quat_xyzw":[0.0,0.0,0.0,1.0],"rgba":[0.5,0.5,0.5,1.0]}],"overlays":{"bin":"best-soft-arm-2f5e4f974b13.ovl.bin","dtype":"float16","byte_order":"little","layout":["frames","channels"],"channels":["offset_mm","seat_short_mm","hold_s","n_contacts"]}}
