{"format":"rtt-replay","version":2,"fps":30,"dtype":"float32","byte_order":"little","layout":["frames","bodies","pose"],"pose_fields":["px","py","pz","qx","qy","qz","qw"],"up_axis":"z","units":"m","n_frames":957,"n_bodies":5,"bin":"best_single.bin","assets":{"30e503738711cdc2":{"uri":"assets/30e503738711cdc2.glb","sha256":"30e503738711cdc2acf88d63ebbdab1ae9ae246d20d8b525d43373fca46fb8ed","bytes":3156,"role":"object","license":"Apache-2.0","attribution":"Robot Tool Tournament (Apache-2.0)","changes":[],"label":"Studio task object: obj_pipe_coupling_seat","media_type":"model/gltf-binary","source":{"kind":"generated","generator":"rtt.render.glb"}},"3b4f5feb7d58485a":{"uri":"assets/3b4f5feb7d58485a.glb","sha256":"3b4f5feb7d58485a33ffe98872e3d28fcf98c7b2a038954f481d2f1109bf1464","bytes":3464,"role":"object","license":"Apache-2.0","attribution":"Robot Tool Tournament (Apache-2.0)","changes":[],"label":"Studio task object: obj_pipe_coupling_member","media_type":"model/gltf-binary","source":{"kind":"generated","generator":"rtt.render.glb"}},"573c7c3c0114e7d7":{"uri":"assets/573c7c3c0114e7d7.glb","sha256":"573c7c3c0114e7d795f25da902c4b6d319b0eb1332f2d3e6dc41f72e4e842427","bytes":2260,"role":"gripper_frame","license":"CC-BY-4.0","attribution":"An open-source parallel gripper, CC BY 4.0, modified (full credit: /credits#gripper)","changes":["the simulation model's collision geometry only, as the simulator used it","re-posed into the replay body frame","re-encoded as GLB"],"label":"Studio tool body: eff_pj_housing","media_type":"model/gltf-binary","source":{"kind":"generated","generator":"rtt.render.glb"}},"58c3d59126c06393":{"uri":"assets/58c3d59126c06393.glb","sha256":"58c3d59126c063935f874384d86f357b82cad4103a69345887ec9ce34930bb93","bytes":18160,"role":"gripper_frame","license":"CC-BY-4.0","attribution":"An open-source parallel gripper, CC BY 4.0, modified (full credit: /credits#gripper)","changes":["the simulation model's collision geometry only, as the simulator used it","re-posed into the replay body frame","re-encoded as GLB"],"label":"Studio tool body: eff_pj_left","media_type":"model/gltf-binary","source":{"kind":"generated","generator":"rtt.render.glb"}},"aad9db51e1bc19ca":{"uri":"assets/aad9db51e1bc19ca.glb","sha256":"aad9db51e1bc19cad49ddcaff2d6fe9ccfd07a36e666c322d4810d01de1d87fd","bytes":2640,"role":"gripper_frame","license":"Apache-2.0","attribution":"Robot Tool Tournament (Apache-2.0)","changes":[],"label":"Studio wrist flange: wrist_flange","media_type":"model/gltf-binary","source":{"kind":"generated","generator":"rtt.render.glb"}},"f5d8d45facd5e3ee":{"uri":"assets/f5d8d45facd5e3ee.glb","sha256":"f5d8d45facd5e3ee76af6f610cf8b3066037aac97102b0f9fac8d9f30fc1174f","bytes":17752,"role":"gripper_frame","license":"CC-BY-4.0","attribution":"An open-source parallel gripper, CC BY 4.0, modified (full credit: /credits#gripper)","changes":["the simulation model's collision geometry only, as the simulator used it","re-posed into the replay body frame","re-encoded as GLB"],"label":"Studio tool body: eff_pj_right","media_type":"model/gltf-binary","source":{"kind":"generated","generator":"rtt.render.glb"}}},"bodies":[{"name":"palm_wrist_flange","visuals":[{"asset":"aad9db51e1bc19ca","pos":[0.0,0.0,0.0],"quat_xyzw":[0.0,0.0,0.0,1.0],"scale":[1.0,1.0,1.0]}]},{"name":"finger_t0_eff_pj_housing","visuals":[{"asset":"573c7c3c0114e7d7","pos":[0.0,0.0,0.0],"quat_xyzw":[0.0,0.0,0.0,1.0],"scale":[1.0,1.0,1.0]}]},{"name":"finger_t0_eff_pj_left","visuals":[{"asset":"58c3d59126c06393","pos":[0.0,0.0,0.0],"quat_xyzw":[0.0,0.0,0.0,1.0],"scale":[1.0,1.0,1.0]}]},{"name":"finger_t0_eff_pj_right","visuals":[{"asset":"f5d8d45facd5e3ee","pos":[0.0,0.0,0.0],"quat_xyzw":[0.0,0.0,0.0,1.0],"scale":[1.0,1.0,1.0]}]},{"name":"object_obj_pipe_coupling_member","visuals":[{"asset":"3b4f5feb7d58485a","pos":[0.0,0.0,0.0],"quat_xyzw":[0.0,0.0,0.0,1.0],"scale":[1.0,1.0,1.0]}]}],"static":[{"name":"table","type":"box","half_size":[0.4,0.4,0.375],"pos":[0.0,0.0,-0.375],"quat_xyzw":[0.0,0.0,0.0,1.0],"rgba":[0.8,0.7,0.56,1.0]}],"meta":{"design_space":"studio-single","design_id":"5367b08cfd9757334f9c396a60276bfa411aa86283cd970d44f8c87fcd63ba09","geometry_id":null,"part_id":"h2","label":"Product mode: not part of the pre-registered experiment","lane":"best_single","setup_label":"Parallel jaw, stock blade: Pipe coupling","task_id":"33599e99ac277cf20e73d6acd349b9422330a255b3fe5ea48c6442a26c3decd6","traj_sha":"a73d7612dbe204a816b0190e5d5a5dd1127c47fed871e95c42aacc160ba06f60","condition_id":"nominal","seed":0,"completed":false,"cycle_time_s":31.894,"segments":[{"index":0,"tool":0,"tool_label":"Parallel jaw, stock blade: Pipe coupling","start_s":0.0,"end_s":31.894,"change":"none","change_s":0.0,"change_start_s":0.0,"steps":["insert_coupling","tighten_coupling"]}],"steps":[{"step_id":"insert_coupling","primitive":"insert","tool":0,"start_s":0.0,"duration_s":6.892,"success":true,"failure_mode":null,"fidelity":"approximation","quantities":{"angle_deg":-0.001,"depth_mm":4.0,"force_n":4.449,"jam":0.0,"lateral_force_n":0.256,"penetration_mm":0.072,"turns":-0.0}},{"step_id":"tighten_coupling","primitive":"twist","tool":0,"start_s":6.892,"duration_s":25.002,"success":false,"failure_mode":"slip","fidelity":"approximation","quantities":{"angle_deg":42.437,"depth_mm":3.547,"force_n":13.539,"penetration_mm":0.314,"slip_deg":86.429,"torque_nm":0.651,"turns":0.118}}],"tool_stand":"display only: a tool that is not on the wrist rests here; nothing about it is simulated"},"provenance":{"source":"simulation","engine":"mujoco","engine_version":"3.15.0","run_id":"studio-h2-5367b08cfd97","code_version":"67c08249edc8","product_mode":true,"episode":"studio full-task run","suite":"studio-heroes","condition":"nominal","seed":0,"task_sha256":"33599e99ac277cf20e73d6acd349b9422330a255b3fe5ea48c6442a26c3decd6","record_version":1},"static_visuals":[{"asset":"30e503738711cdc2","pos":[0.0,0.0,0.0],"quat_xyzw":[0.0,0.0,0.0,1.0],"scale":[1.0,1.0,1.0]}]}
